Test run id: trtac_dg4jhgzdb7a8a98dzwa89c8mw85yd_mee4
Phase started: Ramp-up (index: 0, duration: 30s) 10:48:12(+0700)

--------------------------------------
Metrics for period to: 10:48:20(+0700) (width: 6.763s)
--------------------------------------

errors.Failed capture or match: ................................................ 25
http.codes.429: ................................................................ 52
http.downloaded_bytes: ......................................................... 2860
http.request_rate: ............................................................. 8/sec
http.requests: ................................................................. 52
http.response_time:
  min: ......................................................................... 0
  max: ......................................................................... 1
  mean: ........................................................................ 0.7
  median: ...................................................................... 1
  p95: ......................................................................... 1
  p99: ......................................................................... 1
http.response_time.4xx:
  min: ......................................................................... 0
  max: ......................................................................... 1
  mean: ........................................................................ 0.7
  median: ...................................................................... 1
  p95: ......................................................................... 1
  p99: ......................................................................... 1
http.responses: ................................................................ 52
vusers.completed: .............................................................. 27
vusers.created: ................................................................ 52
vusers.created_by_name.Create new sheet: ....................................... 14
vusers.created_by_name.Open existing sheet: .................................... 13
vusers.created_by_name.Visit homepage: ......................................... 25
vusers.failed: ................................................................. 25
vusers.session_length:
  min: ......................................................................... 2.2
  max: ......................................................................... 24.5
  mean: ........................................................................ 3.6
  median: ...................................................................... 2.9
  p95: ......................................................................... 3.4
  p99: ......................................................................... 4.9


--------------------------------------
Metrics for period to: 10:48:30(+0700) (width: 9.935s)
--------------------------------------

errors.Failed capture or match: ................................................ 82
http.codes.429: ................................................................ 218
http.downloaded_bytes: ......................................................... 11990
http.request_rate: ............................................................. 22/sec
http.requests: ................................................................. 218
http.response_time:
  min: ......................................................................... 0
  max: ......................................................................... 10
  mean: ........................................................................ 0.8
  median: ...................................................................... 1
  p95: ......................................................................... 1
  p99: ......................................................................... 3
http.response_time.4xx:
  min: ......................................................................... 0
  max: ......................................................................... 10
  mean: ........................................................................ 0.8
  median: ...................................................................... 1
  p95: ......................................................................... 1
  p99: ......................................................................... 3
http.responses: ................................................................ 218
vusers.completed: .............................................................. 136
vusers.created: ................................................................ 218
vusers.created_by_name.Create new sheet: ....................................... 67
vusers.created_by_name.Open existing sheet: .................................... 69
vusers.created_by_name.Visit homepage: ......................................... 82
vusers.failed: ................................................................. 82
vusers.session_length:
  min: ......................................................................... 1.8
  max: ......................................................................... 6.6
  mean: ........................................................................ 2.4
  median: ...................................................................... 2.1
  p95: ......................................................................... 3.9
  p99: ......................................................................... 6.1


Phase completed: Ramp-up (index: 0, duration: 30s) 10:48:42(+0700)

Phase started: Sustained Load (index: 1, duration: 90s) 10:48:42(+0700)

--------------------------------------
Metrics for period to: 10:48:40(+0700) (width: 9.988s)
--------------------------------------

errors.Failed capture or match: ................................................ 147
http.codes.429: ................................................................ 387
http.downloaded_bytes: ......................................................... 21285
http.request_rate: ............................................................. 39/sec
http.requests: ................................................................. 387
http.response_time:
  min: ......................................................................... 0
  max: ......................................................................... 3
  mean: ........................................................................ 0.6
  median: ...................................................................... 1
  p95: ......................................................................... 1
  p99: ......................................................................... 2
http.response_time.4xx:
  min: ......................................................................... 0
  max: ......................................................................... 3
  mean: ........................................................................ 0.6
  median: ...................................................................... 1
  p95: ......................................................................... 1
  p99: ......................................................................... 2
http.responses: ................................................................ 387
vusers.completed: .............................................................. 240
vusers.created: ................................................................ 387
vusers.created_by_name.Create new sheet: ....................................... 123
vusers.created_by_name.Open existing sheet: .................................... 117
vusers.created_by_name.Visit homepage: ......................................... 147
vusers.failed: ................................................................. 147
vusers.session_length:
  min: ......................................................................... 1.6
  max: ......................................................................... 5.8
  mean: ........................................................................ 2
  median: ...................................................................... 1.9
  p95: ......................................................................... 2.7
  p99: ......................................................................... 4.3


--------------------------------------
Metrics for period to: 10:48:50(+0700) (width: 9.983s)
--------------------------------------

errors.Failed capture or match: ................................................ 205
http.codes.429: ................................................................ 497
http.downloaded_bytes: ......................................................... 27335
http.request_rate: ............................................................. 50/sec
http.requests: ................................................................. 497
http.response_time:
  min: ......................................................................... 0
  max: ......................................................................... 8
  mean: ........................................................................ 0.2
  median: ...................................................................... 0
  p95: ......................................................................... 1
  p99: ......................................................................... 2
http.response_time.4xx:
  min: ......................................................................... 0
  max: ......................................................................... 8
  mean: ........................................................................ 0.2
  median: ...................................................................... 0
  p95: ......................................................................... 1
  p99: ......................................................................... 2
http.responses: ................................................................ 497
vusers.completed: .............................................................. 292
vusers.created: ................................................................ 497
vusers.created_by_name.Create new sheet: ....................................... 132
vusers.created_by_name.Open existing sheet: .................................... 160
vusers.created_by_name.Visit homepage: ......................................... 205
vusers.failed: ................................................................. 205
vusers.session_length:
  min: ......................................................................... 1.5
  max: ......................................................................... 9.5
  mean: ........................................................................ 2
  median: ...................................................................... 1.9
  p95: ......................................................................... 2.8
  p99: ......................................................................... 5


--------------------------------------
Metrics for period to: 10:49:00(+0700) (width: 9.981s)
--------------------------------------

errors.Failed capture or match: ................................................ 202
http.codes.429: ................................................................ 500
http.downloaded_bytes: ......................................................... 27500
http.request_rate: ............................................................. 50/sec
http.requests: ................................................................. 500
http.response_time:
  min: ......................................................................... 0
  max: ......................................................................... 8
  mean: ........................................................................ 0.1
  median: ...................................................................... 0
  p95: ......................................................................... 1
  p99: ......................................................................... 2
http.response_time.4xx:
  min: ......................................................................... 0
  max: ......................................................................... 8
  mean: ........................................................................ 0.1
  median: ...................................................................... 0
  p95: ......................................................................... 1
  p99: ......................................................................... 2
http.responses: ................................................................ 500
vusers.completed: .............................................................. 298
vusers.created: ................................................................ 500
vusers.created_by_name.Create new sheet: ....................................... 151
vusers.created_by_name.Open existing sheet: .................................... 147
vusers.created_by_name.Visit homepage: ......................................... 202
vusers.failed: ................................................................. 202
vusers.session_length:
  min: ......................................................................... 1.7
  max: ......................................................................... 5.9
  mean: ........................................................................ 2
  median: ...................................................................... 1.8
  p95: ......................................................................... 3.2
  p99: ......................................................................... 4.4


--------------------------------------
Metrics for period to: 10:49:10(+0700) (width: 9.982s)
--------------------------------------

errors.Failed capture or match: ................................................ 205
http.codes.429: ................................................................ 500
http.downloaded_bytes: ......................................................... 27500
http.request_rate: ............................................................. 50/sec
http.requests: ................................................................. 500
http.response_time:
  min: ......................................................................... 0
  max: ......................................................................... 6
  mean: ........................................................................ 0.1
  median: ...................................................................... 0
  p95: ......................................................................... 1
  p99: ......................................................................... 2
http.response_time.4xx:
  min: ......................................................................... 0
  max: ......................................................................... 6
  mean: ........................................................................ 0.1
  median: ...................................................................... 0
  p95: ......................................................................... 1
  p99: ......................................................................... 2
http.responses: ................................................................ 500
vusers.completed: .............................................................. 295
vusers.created: ................................................................ 500
vusers.created_by_name.Create new sheet: ....................................... 147
vusers.created_by_name.Open existing sheet: .................................... 148
vusers.created_by_name.Visit homepage: ......................................... 205
vusers.failed: ................................................................. 205
vusers.session_length:
  min: ......................................................................... 1.7
  max: ......................................................................... 9
  mean: ........................................................................ 1.9
  median: ...................................................................... 1.7
  p95: ......................................................................... 2.6
  p99: ......................................................................... 4.2


--------------------------------------
Metrics for period to: 10:49:20(+0700) (width: 9.982s)
--------------------------------------

errors.Failed capture or match: ................................................ 187
http.codes.429: ................................................................ 500
http.downloaded_bytes: ......................................................... 27500
http.request_rate: ............................................................. 50/sec
http.requests: ................................................................. 500
http.response_time:
  min: ......................................................................... 0
  max: ......................................................................... 6
  mean: ........................................................................ 0.1
  median: ...................................................................... 0
  p95: ......................................................................... 1
  p99: ......................................................................... 2
http.response_time.4xx:
  min: ......................................................................... 0
  max: ......................................................................... 6
  mean: ........................................................................ 0.1
  median: ...................................................................... 0
  p95: ......................................................................... 1
  p99: ......................................................................... 2
http.responses: ................................................................ 500
vusers.completed: .............................................................. 313
vusers.created: ................................................................ 500
vusers.created_by_name.Create new sheet: ....................................... 165
vusers.created_by_name.Open existing sheet: .................................... 148
vusers.created_by_name.Visit homepage: ......................................... 187
vusers.failed: ................................................................. 187
vusers.session_length:
  min: ......................................................................... 1.6
  max: ......................................................................... 8.4
  mean: ........................................................................ 2
  median: ...................................................................... 1.8
  p95: ......................................................................... 2.6
  p99: ......................................................................... 4.3


--------------------------------------
Metrics for period to: 10:49:30(+0700) (width: 9.982s)
--------------------------------------

errors.Failed capture or match: ................................................ 191
http.codes.429: ................................................................ 500
http.downloaded_bytes: ......................................................... 27500
http.request_rate: ............................................................. 50/sec
http.requests: ................................................................. 500
http.response_time:
  min: ......................................................................... 0
  max: ......................................................................... 7
  mean: ........................................................................ 0.1
  median: ...................................................................... 0
  p95: ......................................................................... 1
  p99: ......................................................................... 1
http.response_time.4xx:
  min: ......................................................................... 0
  max: ......................................................................... 7
  mean: ........................................................................ 0.1
  median: ...................................................................... 0
  p95: ......................................................................... 1
  p99: ......................................................................... 1
http.responses: ................................................................ 500
vusers.completed: .............................................................. 309
vusers.created: ................................................................ 500
vusers.created_by_name.Create new sheet: ....................................... 140
vusers.created_by_name.Open existing sheet: .................................... 169
vusers.created_by_name.Visit homepage: ......................................... 191
vusers.failed: ................................................................. 191
vusers.session_length:
  min: ......................................................................... 1.8
  max: ......................................................................... 9.3
  mean: ........................................................................ 2.1
  median: ...................................................................... 2
  p95: ......................................................................... 2.6
  p99: ......................................................................... 5.1


--------------------------------------
Metrics for period to: 10:49:40(+0700) (width: 9.982s)
--------------------------------------

errors.Failed capture or match: ................................................ 193
http.codes.429: ................................................................ 500
http.downloaded_bytes: ......................................................... 27500
http.request_rate: ............................................................. 50/sec
http.requests: ................................................................. 500
http.response_time:
  min: ......................................................................... 0
  max: ......................................................................... 7
  mean: ........................................................................ 0.1
  median: ...................................................................... 0
  p95: ......................................................................... 1
  p99: ......................................................................... 2
http.response_time.4xx:
  min: ......................................................................... 0
  max: ......................................................................... 7
  mean: ........................................................................ 0.1
  median: ...................................................................... 0
  p95: ......................................................................... 1
  p99: ......................................................................... 2
http.responses: ................................................................ 500
vusers.completed: .............................................................. 307
vusers.created: ................................................................ 500
vusers.created_by_name.Create new sheet: ....................................... 166
vusers.created_by_name.Open existing sheet: .................................... 141
vusers.created_by_name.Visit homepage: ......................................... 193
vusers.failed: ................................................................. 193
vusers.session_length:
  min: ......................................................................... 1.8
  max: ......................................................................... 6.6
  mean: ........................................................................ 2.1
  median: ...................................................................... 1.9
  p95: ......................................................................... 2.6
  p99: ......................................................................... 3.9


--------------------------------------
Metrics for period to: 10:49:50(+0700) (width: 9.982s)
--------------------------------------

errors.Failed capture or match: ................................................ 191
http.codes.429: ................................................................ 500
http.downloaded_bytes: ......................................................... 27500
http.request_rate: ............................................................. 50/sec
http.requests: ................................................................. 500
http.response_time:
  min: ......................................................................... 0
  max: ......................................................................... 7
  mean: ........................................................................ 0.1
  median: ...................................................................... 0
  p95: ......................................................................... 1
  p99: ......................................................................... 2
http.response_time.4xx:
  min: ......................................................................... 0
  max: ......................................................................... 7
  mean: ........................................................................ 0.1
  median: ...................................................................... 0
  p95: ......................................................................... 1
  p99: ......................................................................... 2
http.responses: ................................................................ 500
vusers.completed: .............................................................. 309
vusers.created: ................................................................ 500
vusers.created_by_name.Create new sheet: ....................................... 143
vusers.created_by_name.Open existing sheet: .................................... 166
vusers.created_by_name.Visit homepage: ......................................... 191
vusers.failed: ................................................................. 191
vusers.session_length:
  min: ......................................................................... 1.8
  max: ......................................................................... 7.7
  mean: ........................................................................ 2
  median: ...................................................................... 1.9
  p95: ......................................................................... 2.6
  p99: ......................................................................... 4.4


--------------------------------------
Metrics for period to: 10:50:00(+0700) (width: 9.982s)
--------------------------------------

errors.Failed capture or match: ................................................ 198
http.codes.429: ................................................................ 500
http.downloaded_bytes: ......................................................... 27500
http.request_rate: ............................................................. 50/sec
http.requests: ................................................................. 500
http.response_time:
  min: ......................................................................... 0
  max: ......................................................................... 8
  mean: ........................................................................ 0.1
  median: ...................................................................... 0
  p95: ......................................................................... 1
  p99: ......................................................................... 2
http.response_time.4xx:
  min: ......................................................................... 0
  max: ......................................................................... 8
  mean: ........................................................................ 0.1
  median: ...................................................................... 0
  p95: ......................................................................... 1
  p99: ......................................................................... 2
http.responses: ................................................................ 500
vusers.completed: .............................................................. 302
vusers.created: ................................................................ 500
vusers.created_by_name.Create new sheet: ....................................... 166
vusers.created_by_name.Open existing sheet: .................................... 136
vusers.created_by_name.Visit homepage: ......................................... 198
vusers.failed: ................................................................. 198
vusers.session_length:
  min: ......................................................................... 1.8
  max: ......................................................................... 4.6
  mean: ........................................................................ 1.9
  median: ...................................................................... 1.9
  p95: ......................................................................... 2.3
  p99: ......................................................................... 3


Phase completed: Sustained Load (index: 1, duration: 90s) 10:50:12(+0700)

--------------------------------------
Metrics for period to: 10:50:10(+0700) (width: 9.982s)
--------------------------------------

errors.Failed capture or match: ................................................ 199
http.codes.429: ................................................................ 500
http.downloaded_bytes: ......................................................... 27500
http.request_rate: ............................................................. 50/sec
http.requests: ................................................................. 500
http.response_time:
  min: ......................................................................... 0
  max: ......................................................................... 9
  mean: ........................................................................ 0.1
  median: ...................................................................... 0
  p95: ......................................................................... 1
  p99: ......................................................................... 2
http.response_time.4xx:
  min: ......................................................................... 0
  max: ......................................................................... 9
  mean: ........................................................................ 0.1
  median: ...................................................................... 0
  p95: ......................................................................... 1
  p99: ......................................................................... 2
http.responses: ................................................................ 500
vusers.completed: .............................................................. 301
vusers.created: ................................................................ 500
vusers.created_by_name.Create new sheet: ....................................... 157
vusers.created_by_name.Open existing sheet: .................................... 144
vusers.created_by_name.Visit homepage: ......................................... 199
vusers.failed: ................................................................. 199
vusers.session_length:
  min: ......................................................................... 1.8
  max: ......................................................................... 10.7
  mean: ........................................................................ 2.1
  median: ...................................................................... 1.9
  p95: ......................................................................... 2.5
  p99: ......................................................................... 8.2


--------------------------------------
Metrics for period to: 10:50:20(+0700) (width: 2.202s)
--------------------------------------

errors.Failed capture or match: ................................................ 52
http.codes.429: ................................................................ 111
http.downloaded_bytes: ......................................................... 6105
http.request_rate: ............................................................. 50/sec
http.requests: ................................................................. 111
http.response_time:
  min: ......................................................................... 0
  max: ......................................................................... 7
  mean: ........................................................................ 0.2
  median: ...................................................................... 0
  p95: ......................................................................... 1
  p99: ......................................................................... 1
http.response_time.4xx:
  min: ......................................................................... 0
  max: ......................................................................... 7
  mean: ........................................................................ 0.2
  median: ...................................................................... 0
  p95: ......................................................................... 1
  p99: ......................................................................... 1
http.responses: ................................................................ 111
vusers.completed: .............................................................. 59
vusers.created: ................................................................ 111
vusers.created_by_name.Create new sheet: ....................................... 27
vusers.created_by_name.Open existing sheet: .................................... 32
vusers.created_by_name.Visit homepage: ......................................... 52
vusers.failed: ................................................................. 52
vusers.session_length:
  min: ......................................................................... 1.8
  max: ......................................................................... 4.7
  mean: ........................................................................ 1.9
  median: ...................................................................... 1.8
  p95: ......................................................................... 2.2
  p99: ......................................................................... 2.6


All VUs finished. Total time: 2 minutes, 0 seconds

--------------------------------
Summary report @ 10:50:13(+0700)
--------------------------------

errors.Failed capture or match: ................................................ 2077
http.codes.429: ................................................................ 5265
http.downloaded_bytes: ......................................................... 289575
http.request_rate: ............................................................. 44/sec
http.requests: ................................................................. 5265
http.response_time:
  min: ......................................................................... 0
  max: ......................................................................... 10
  mean: ........................................................................ 0.2
  median: ...................................................................... 0
  p95: ......................................................................... 1
  p99: ......................................................................... 2
http.response_time.4xx:
  min: ......................................................................... 0
  max: ......................................................................... 10
  mean: ........................................................................ 0.2
  median: ...................................................................... 0
  p95: ......................................................................... 1
  p99: ......................................................................... 2
http.responses: ................................................................ 5265
vusers.completed: .............................................................. 3188
vusers.created: ................................................................ 5265
vusers.created_by_name.Create new sheet: ....................................... 1598
vusers.created_by_name.Open existing sheet: .................................... 1590
vusers.created_by_name.Visit homepage: ......................................... 2077
vusers.failed: ................................................................. 2077
vusers.session_length:
  min: ......................................................................... 1.5
  max: ......................................................................... 24.5
  mean: ........................................................................ 2
  median: ...................................................................... 1.9
  p95: ......................................................................... 2.8
  p99: ......................................................................... 5
